token,label_original,label_sugerido,confianca,sentenca_idx,contexto
nos,O,B-OBRIGACAO,0.25106249632279465,835,"de parecer prévio, nos termos da Resolução"
conforme,O,B-OBRIGACAO,0.25106249632279465,830,"contas como Irregulares, conforme art. 29-A, §1°,"
da,O,B-OBRIGACAO,0.25106249632279465,835,"prévio, nos termos da Resolução n.º 031/2018-TCE/RN,"
"Federal,",O,B-OBRIGACAO,0.25106249632279465,830,"§1°, da Constituição Federal, pelo pagamento acima"
Resolução,O,B-OBRIGACAO,0.25106249632279465,835,"nos termos da Resolução n.º 031/2018-TCE/RN, no"
no,O,B-OBRIGACAO,0.25106249632279465,835,"Resolução n.º 031/2018-TCE/RN, no sentido da inclusão"
sentido,O,B-OBRIGACAO,0.25106249632279465,835,"n.º 031/2018-TCE/RN, no sentido da inclusão do"
prática,O,B-OBRIGACAO,0.25106249632279465,835,de apuração da prática de ato de
g),O,B-OBRIGACAO,0.25106249632279465,849,Estadual nº 464/2012; g) aplicação de multa
encaminhada,O,B-OBRIGACAO,0.25106249632279465,835,lista a ser encaminhada à Justiça Eleitoral
os,O,B-OBRIGACAO,0.25106249632279465,835,Justiça Eleitoral para os fins do art.
Complementar,O,B-OBRIGACAO,0.25106249632279465,835,"`g`, da Lei Complementar nº 64, de"
de,O,B-OBRIGACAO,0.25106249632279465,835,"64, de 18 de maio de 1990,"
Lei,O,B-OBRIGACAO,0.25106249632279465,835,"1990, alterado pela Lei Complementar 135, de"
"2010,",O,B-OBRIGACAO,0.25106249632279465,835,"de junho de 2010, submetendo-o à Câmara"
peças,O,B-OBRIGACAO,0.25106249632279465,835,cópias das principais peças deste processo ao
consoante,O,B-OBRIGACAO,0.25106249632279465,530,"a sua correção, consoante as determinações expostas"
sua,O,B-OBRIGACAO,0.25106249632279465,530,"somente, demanda a sua correção, consoante as"
a,O,B-OBRIGACAO,0.25106249632279465,530,"tão somente, demanda a sua correção, consoante"
demanda,O,B-OBRIGACAO,0.25106249632279465,530,"mas, tão somente, demanda a sua correção,"
Município,O,B-OBRIGACAO,0.25106249632279465,835,"Câmara Municipal do Município de Nísia Floresta-RN,"
Nísia,O,B-OBRIGACAO,0.25106249632279465,835,"do Município de Nísia Floresta-RN, para se"
"Floresta-RN,",O,B-OBRIGACAO,0.25106249632279465,835,"Município de Nísia Floresta-RN, para se pronunciar"
da,O,B-OBRIGACAO,0.25106249632279465,835,"031/2018-TCE/RN, no sentido da inclusão do nome"
do,O,B-OBRIGACAO,0.25106249632279465,835,"sobre este ponto do julgamento. Por fim,"
§2.,O,B-OBRIGACAO,0.25106249632279465,830,"conforme art. 78, §2. º, “b” da"
"ensejam,",O,B-OBRIGACAO,0.25106249632279465,82,"permanecem caracterizadas e ensejam, em seu conjunto,"
"Ademais,",O,B-OBRIGACAO,0.25106249632279465,408,"e impropriedades identificadas. Ademais, intime-se o Sr."
Justiça,O,B-OBRIGACAO,0.25106249632279465,852,ser encaminhada à Justiça Eleitoral para os
Campo,O,B-OBRIGACAO,0.25106249632279465,408,"do Município de Campo Redondo/RN, e Sr."
Alencar,O,B-OBRIGACAO,0.25106249632279465,408,"Renam Luiz de Alencar Carvalho, Prefeito do"
ser,O,B-OBRIGACAO,0.25106249632279465,852,na lista a ser encaminhada à Justiça
lista,O,B-OBRIGACAO,0.25106249632279465,852,HONÓRIO LISBOA na lista a ser encaminhada
LISBOA,O,B-OBRIGACAO,0.25106249632279465,852,RUDSON RAIMUNDO HONÓRIO LISBOA na lista a
efetivo,O,B-OBRIGACAO,0.25106249632279465,408,se possibilitar o efetivo saneamento das falhas
do,O,B-OBRIGACAO,0.25106249632279465,852,incluído o nome do Sr. RUDSON RAIMUNDO
seja,O,B-OBRIGACAO,0.25106249632279465,852,sentido de que seja incluído o nome
e,O,B-OBRIGACAO,0.25106249632279465,408,"de Campo Redondo/RN, e o atual responsável"
o,O,B-OBRIGACAO,0.25106249632279465,408,"Campo Redondo/RN, e o atual responsável pela"
acerca,O,B-OBRIGACAO,0.25106249632279465,408,Interno do Município acerca dos termos desta
e,O,B-OBRIGACAO,0.25106249632279465,408,"poderá prorrogar prazos e ajustar medidas, a"
consignado,O,B-OBRIGACAO,0.25106249632279465,408,"mora. Fica ainda consignado que, durante o"
da,O,B-OBRIGACAO,0.25106249632279465,835,fins de apuração da prática de ato
fins,O,B-OBRIGACAO,0.25106249632279465,835,"Público Estadual, para fins de apuração da"
para,O,B-OBRIGACAO,0.25106249632279465,835,"Ministério Público Estadual, para fins de apuração"
"Estadual,",O,B-OBRIGACAO,0.25106249632279465,835,"ao Ministério Público Estadual, para fins de"
Procuradoria,O,B-OBRIGACAO,0.25106249632279465,830,"que indicar, à Procuradoria Geral do Estado"
"conjunto,",O,B-OBRIGACAO,0.25106249632279465,82,"ensejam, em seu conjunto, a manutenção do"
processo,O,B-OBRIGACAO,0.25106249632279465,835,principais peças deste processo ao Ministério Público
ao,O,B-OBRIGACAO,0.25106249632279465,830,do Estado e ao Ministério Público para
a,O,B-OBRIGACAO,0.25106249632279465,830,"Ministério Público para a instauração, respectivamente, das"
"instauração,",O,B-OBRIGACAO,0.25106249632279465,830,"Público para a instauração, respectivamente, das ações"
"respectivamente,",O,B-OBRIGACAO,0.25106249632279465,830,"para a instauração, respectivamente, das ações cíveis"
ações,O,B-OBRIGACAO,0.25106249632279465,830,"instauração, respectivamente, das ações cíveis e criminais"
e,O,B-OBRIGACAO,0.25106249632279465,830,"das ações cíveis e criminais cabíveis, conforme"
Ação,O,B-OBRIGACAO,0.25106249632279465,408,"no Plano de Ação proposto, o Relator"
conforme,O,B-OBRIGACAO,0.25106249632279465,830,"e criminais cabíveis, conforme art. 78, §2."
que,O,B-OBRIGACAO,0.25106249632279465,82,do Acórdão recorrido que julgou pela desaprovação
de,O,B-OBRIGACAO,0.25106249632279465,835,"sem a interposição de recurso, deverá a"
de,O,B-OBRIGACAO,0.25106249632279465,830,limite máximo legal de 70% (setenta por
Por,O,B-OBRIGACAO,0.25106249632279465,852,"época da inspeção. Por conseguinte, pela remessa"
464/2012.,O,B-OBRIGACAO,0.25106249632279465,835,Complementar Estadual n.º 464/2012.
cópias,O,B-OBRIGACAO,0.25106249632279465,835,o encaminhamento de cópias das principais peças
(setenta,O,B-OBRIGACAO,0.25106249632279465,830,legal de 70% (setenta por cento) de
receita,O,B-OBRIGACAO,0.25106249632279465,830,cento) de sua receita com folha de
Resolução,O,B-OBRIGACAO,0.25106249632279465,835,"Tribunal e na Resolução n.º 013/2015-TCE, conforme"
que,O,B-OBRIGACAO,0.25106249632279465,82,"de 2014, dado que as demais inconformidades"
peças,O,B-OBRIGACAO,0.25106249632279465,852,remessa imediata de peças ao Ministério Público
dos,O,B-OBRIGACAO,0.25106249632279465,835,"com o teor dos 18, inciso I,"
imediata,O,B-OBRIGACAO,0.25106249632279465,852,"conseguinte, pela remessa imediata de peças ao"
Câmara,O,B-OBRIGACAO,0.25106249632279465,82,132/2019-TC – 1ª Câmara a fim de
deste,O,B-OBRIGACAO,0.25106249632279465,835,na Lei Orgânica deste Tribunal e na
inspeção.,O,B-OBRIGACAO,0.25106249632279465,852,"à época da inspeção. Por conseguinte, pela"
n.º,O,B-OBRIGACAO,0.25106249632279465,835,"“a”, da LCE n.º 121/1994. Determando o"
E,O,B-OBRIGACAO,0.25106249632279465,852,"Sr. GERALDO ROCHA E SILVA JÚNIOR, gestor"
e,O,B-OBRIGACAO,0.25106249632279465,835,Orgânica deste Tribunal e na Resolução n.º
"78,",O,B-OBRIGACAO,0.25106249632279465,835,"impõe o art. 78, § 2º, alínea"
pela,O,B-OBRIGACAO,0.25106249632279465,852,"inspeção. Por conseguinte, pela remessa imediata de"
irregularidades,O,B-OBRIGACAO,0.25106249632279465,852,pelo afastamento das irregularidades formais (ausência de
ROCHA,O,B-OBRIGACAO,0.25106249632279465,852,"ao Sr. GERALDO ROCHA E SILVA JÚNIOR,"
os,O,B-OBRIGACAO,0.25106249632279465,835,julgado e adotar os procedimentos necessários à
ser,O,B-OBRIGACAO,0.25106249632279465,835,os valores deverão ser devidamente atualizados na
inconformidades,O,B-OBRIGACAO,0.25106249632279465,82,que as demais inconformidades e impropriedades permanecem
exclusivamente,O,B-OBRIGACAO,0.25106249632279465,852,de Parecer Prévio exclusivamente no sentido de
de,O,B-OBRIGACAO,0.25106249632279465,852,"fim, pela emissão de Parecer Prévio exclusivamente"
Todos,O,B-OBRIGACAO,0.25106249632279465,835,do metro quadrado; Todos os valores deverão
valores,O,B-OBRIGACAO,0.25106249632279465,835,quadrado; Todos os valores deverão ser devidamente
deverá,O,B-OBRIGACAO,0.25106249632279465,835,"interposição de recurso, deverá a Diretoria de"
certificar,O,B-OBRIGACAO,0.25106249632279465,835,Execuções – DAE certificar o seu trânsito
sentido,O,I-OBRIGACAO,0.23742887330169699,778,a decisão no sentido de afastá-las por
já,O,I-OBRIGACAO,0.23742887330169699,784,determina a decisão já transcrita anteriormente (Acórdão
decisão,O,I-OBRIGACAO,0.23742887330169699,784,consoante determina a decisão já transcrita anteriormente
de,O,I-OBRIGACAO,0.23742887330169699,778,decisão no sentido de afastá-las por restarem
a,O,I-OBRIGACAO,0.23742887330169699,784,"voto, consoante determina a decisão já transcrita"
irregularidades,O,I-OBRIGACAO,0.23742887330169699,778,restarem sanadas as irregularidades diante dos documentos
Ministério,O,I-OBRIGACAO,0.23742887330169699,230,representar imediatamente ao Ministério Público Estadual para
julgado,O,I-OBRIGACAO,0.23742887330169699,784,o trânsito em julgado proceda-se a execução
afastá-las,O,I-OBRIGACAO,0.23742887330169699,778,no sentido de afastá-las por restarem sanadas
contidas,O,I-OBRIGACAO,0.23742887330169699,784,"cumprimento das recomendações contidas neste voto, consoante"
partir,O,I-OBRIGACAO,0.23742887330169699,223,"n° 560/2020, a partir de JUNHO de"
recomendações,O,I-OBRIGACAO,0.23742887330169699,784,"ao cumprimento das recomendações contidas neste voto,"
vistas,O,I-RECOMENDACAO,0.9150543376230965,247,adote procedimentos com vistas a impedir a
ao,O,I-OBRIGACAO,0.6216760921997374,628,apuração do dano ao erário causado pelo
correção,O,I-RECOMENDACAO,0.47538506699050814,700,posturas aptas à correção das falhas apontadas
a,O,I-RECOMENDACAO,0.9103622931461418,94,procedimentos com vistas a impedir a consumação
âmbito,O,I-OBRIGACAO,0.7181810187628057,628,"não determinação, no âmbito deste processo, de"
Corte,O,I-RECOMENDACAO,0.914136163013662,92,"– SECEX desta Corte de Contas, que"
de,O,I-RECOMENDACAO,0.9154923396447139,247,recomende à Secretaria de Controle Externo –
com,O,I-RECOMENDACAO,0.9157123717991666,92,que adote procedimentos com vistas a impedir
•,O,I-OBRIGACAO,0.9010084753484134,629,da autoridade administrativa: • fazer cessar o
a,O,I-OBRIGACAO,0.9095921225220344,629,"mínimo nacional, adequando a concessão dos proventos"
consumação,O,I-RECOMENDACAO,0.9133446232792067,107,a impedir a consumação de prescrição nas
Secretaria,O,I-RECOMENDACAO,0.9143707441399007,107,se recomende à Secretaria de Controle Externo
as,I-MULTA,I-RECOMENDACAO,0.5439872198499722,819,bem como numere as paginas de doto
a,O,I-RECOMENDACAO,0.9147992246924248,155,procedimentos com vistas a impedir a consumação
artigo,I-OBRIGACAO,I-MULTA,0.8866237419805291,336,"nos termos do artigo 107, inciso II,"
com,O,I-RECOMENDACAO,0.9145268459251419,94,que adote procedimentos com vistas a impedir
da,O,I-RESSARCIMENTO,0.7580377214453221,807,"II e IV, da Lei Complementar nº"
a,O,I-RECOMENDACAO,0.9168149721987601,142,"nas Unidades Técnicas a ela vinculadas. Também,"
R$,O,I-OBRIGACAO,0.2183443739057029,778,"automotivos; e de R$ 78.000,00 (setenta e"
pelo,O,I-OBRIGACAO,0.2183443739057029,93,diploma). Conforme pacificado pelo enunciado sumular 29
externo,O,I-OBRIGACAO,0.2183443739057029,93,secretaria de controle externo (art. 431 IV
de,O,I-OBRIGACAO,0.2183443739057029,778,"lubrificantes automotivos; e de R$ 78.000,00 (setenta"
de,O,I-OBRIGACAO,0.2183443739057029,849,após a comprovação de que trata o
ao,O,I-OBRIGACAO,0.2183443739057029,835,"peças deste processo ao Ministério Público Estadual,"
2.000,O,I-OBRIGACAO,0.2183443739057029,778,pela aquisição de 2.000 (duas mil) cestas
Tribunal,O,I-OBRIGACAO,0.2183443739057029,835,Lei Orgânica deste Tribunal e na Resolução
aquisição,O,I-OBRIGACAO,0.2183443739057029,778,mil reais) pela aquisição de 2.000 (duas
de,O,I-OBRIGACAO,0.2183443739057029,93,anotado pela secretaria de controle externo (art.
de,O,I-OBRIGACAO,0.2183443739057029,835,"Estadual, para fins de apuração da prática"
pela,O,I-OBRIGACAO,0.2183443739057029,778,oito mil reais) pela aquisição de 2.000
Balanço,O,I-OBRIGACAO,0.2183443739057029,84,Patrimonial informado no Balanço Patrimonial e na
diploma).,O,I-OBRIGACAO,0.2183443739057029,93,“c” do referido diploma). Conforme pacificado pelo
h),O,I-OBRIGACAO,0.2183443739057029,849,Orgânica do TCE/RN; h) recomendação à Câmara
que,O,I-OBRIGACAO,0.2183443739057029,849,a comprovação de que trata o parágrafo
e,O,I-OBRIGACAO,0.2183443739057029,778,"e lubrificantes automotivos; e de R$ 78.000,00"
Lei,O,I-OBRIGACAO,0.2183443739057029,835,forma prevista na Lei Orgânica deste Tribunal
o,O,I-OBRIGACAO,0.2183443739057029,849,"de que trata o parágrafo anterior, os"
na,O,I-OBRIGACAO,0.2183443739057029,835,na forma prevista na Lei Orgânica deste
pacificado,O,I-OBRIGACAO,0.2183443739057029,93,referido diploma). Conforme pacificado pelo enunciado sumular
referido,O,I-OBRIGACAO,0.2183443739057029,93,IV “c” do referido diploma). Conforme pacificado
devidamente,O,I-OBRIGACAO,0.2183443739057029,835,valores deverão ser devidamente atualizados na forma
Parecer,O,I-OBRIGACAO,0.2183443739057029,84,as conclusões do Parecer não excluem o
aplicação,O,I-OBRIGACAO,0.2183443739057029,799,012/2007; b.3) pela aplicação de multa no
de,O,I-OBRIGACAO,0.2183443739057029,93,"ainda, pela extração de cópias desta proposta"
cautelar,O,I-OBRIGACAO,0.2183443739057029,849,cumprimento da medida cautelar de suspensão dos
principais,O,I-OBRIGACAO,0.2183443739057029,835,de cópias das principais peças deste processo
recurso,O,I-OBRIGACAO,0.2183443739057029,337,a interposição de recurso em face do
o,O,I-OBRIGACAO,0.2183443739057029,849,"05 (cinco) dias, o cumprimento da medida"
05,O,I-OBRIGACAO,0.2183443739057029,849,"no prazo de 05 (cinco) dias, o"
deverá,O,I-OBRIGACAO,0.2183443739057029,849,"São Vicente, que deverá comprovar, no prazo"
apontado,O,I-OBRIGACAO,0.2183443739057029,84,"Balanço Patrimonial, conforme apontado no Relatório da"
"Tribunal,",O,I-OBRIGACAO,0.2183443739057029,84,"julgamento, por este Tribunal, das Contas individualizadas"
"Vicente,",O,I-OBRIGACAO,0.2183443739057029,849,"Municipal de São Vicente, que deverá comprovar,"
"Ainda,",O,I-OBRIGACAO,0.2183443739057029,337,"022/2011 – TCE; Ainda, no sentido de"
interposição,O,I-OBRIGACAO,0.2183443739057029,337,legal sem a interposição de recurso em
que,O,I-OBRIGACAO,0.2183443739057029,337,no sentido de que a irregularidade identificada
este,O,I-OBRIGACAO,0.2183443739057029,84,"o julgamento, por este Tribunal, das Contas"
nº,O,I-OBRIGACAO,0.2183443739057029,337,disposto na Súmula nº 29 do TCE/RN.
o,O,I-OBRIGACAO,0.2183443739057029,84,"Parecer não excluem o julgamento, por este"
remessa,O,I-OBRIGACAO,0.2183443739057029,93,acórdão correlato com remessa imediata à atual
da,O,I-OBRIGACAO,0.2183443739057029,93,à atual gestão da CÂMARA MUNICIPAL DE
expedição,O,I-OBRIGACAO,0.2183443739057029,84,5) Determinar a expedição de recomendação ao
evidenciado,O,I-OBRIGACAO,0.2183443739057029,84,"do Passivo Financeiro evidenciado no Balanço Patrimonial,"
do,O,I-OBRIGACAO,0.2183443739057029,93,pela não inclusão do Sr. SAINT CLAY
apresentados.,O,I-OBRIGACAO,0.2183443739057029,778,e argumentos recursais apresentados.
documentos,O,I-OBRIGACAO,0.2183443739057029,778,irregularidades diante dos documentos e argumentos recursais
efetividade,O,I-OBRIGACAO,0.2183443739057029,93,"fracionário, intencionando a efetividade do direito fundamental"
CLAY,O,I-OBRIGACAO,0.2183443739057029,93,do Sr. SAINT CLAY ALCÂNTARA SILVA DE
valores,O,I-OBRIGACAO,0.2183443739057029,84,"dinheiros, bens e valores públicos."
Patrimoniais;,O,I-OBRIGACAO,0.2183443739057029,84,Demonstração das Variações Patrimoniais; Distorção no Patrimônio
de,O,I-OBRIGACAO,0.2183443739057029,835,Fundeb; h)o dever de ressarcimento da quantia
"Ademais,",O,I-OBRIGACAO,0.2183443739057029,849,"II, da LRF. Ademais, pela intimação da"
as,O,I-OBRIGACAO,0.2183443739057029,84,6) Esclarecer que as conclusões do Parecer
de,O,I-OBRIGACAO,0.2183443739057029,835,apuração da prática de ato de improbidade
intimação,O,I-OBRIGACAO,0.2183443739057029,849,"LRF. Ademais, pela intimação da atual Prefeita"
que,O,I-OBRIGACAO,0.2183443739057029,849,"pagamentos. Por fim, que após a comprovação"
o,O,I-OBRIGACAO,0.2183443739057029,835,n.º 121/1994. Determando o encaminhamento de cópias
(precedente:,O,I-OBRIGACAO,0.2183443739057029,93,"à JUSTIÇA ELEITORAL (precedente: acórdão 67/2022, autos"
o,O,I-OBRIGACAO,0.2183443739057029,84,Líquido; Distorção entre o saldo da Dívida
adotar,O,I-OBRIGACAO,0.2183443739057029,337,"e, por conseguinte, adotar os procedimentos necessários"
autos,O,I-OBRIGACAO,0.2183443739057029,93,"(precedente: acórdão 67/2022, autos 430/2019). E ainda,"
responsabilidade,O,I-OBRIGACAO,0.2183443739057029,84,Contas individualizadas de responsabilidade dos ordenadores de
encaminhamento,O,I-OBRIGACAO,0.2183443739057029,835,121/1994. Determando o encaminhamento de cópias das
dos,O,I-OBRIGACAO,0.2183443739057029,778,as irregularidades diante dos documentos e argumentos
da,O,I-OBRIGACAO,0.2183443739057029,84,entre o saldo da Dívida Flutuante e
Dívida,O,I-OBRIGACAO,0.2183443739057029,84,o saldo da Dívida Flutuante e o
fins,O,I-OBRIGACAO,0.2183443739057029,852,"Eleitoral para os fins do art. 1º,"
(setenta,O,I-OBRIGACAO,0.2183443739057029,778,"de R$ 78.000,00 (setenta e oito mil"
Distorção,O,I-OBRIGACAO,0.2183443739057029,84,no Balanço Patrimonial; Distorção do valor do
de,O,I-OBRIGACAO,0.2183443739057029,223,Sr. Francisco Neri de Oliveira e Sr.
à,O,I-OBRIGACAO,0.2183443739057029,230,que dê cumprimento à execução da multa
os,O,I-OBRIGACAO,0.2183443739057029,223,"responsável indicado. Intimem-se os responsáveis, Sr. Francisco"
parte,O,I-OBRIGACAO,0.2183443739057029,223,improbidade administrativa por parte do responsável indicado.
Financeiro,O,I-OBRIGACAO,0.2183443739057029,84,informado no Balanço Financeiro e no Balanço
administrativa,O,I-OBRIGACAO,0.2183443739057029,223,ato de improbidade administrativa por parte do
desaprovação,O,I-OBRIGACAO,0.2183443739057029,82,Parecer Prévio pela desaprovação das Contas Anuais
bens,O,I-OBRIGACAO,0.2183443739057029,523,"responsáveis por dinheiros, bens e valores públicos."
multa,O,I-OBRIGACAO,0.2183443739057029,230,à execução da multa cominada em função
caracterizadas,O,I-OBRIGACAO,0.2183443739057029,82,"e impropriedades permanecem caracterizadas e ensejam, em"
em,O,I-OBRIGACAO,0.2183443739057029,608,"o seu trânsito em julgado e, por"
"e,",O,I-OBRIGACAO,0.2183443739057029,608,"trânsito em julgado e, por conseguinte, adotar"
descumprimento,O,I-OBRIGACAO,0.2183443739057029,230,em função do descumprimento da medida cautelar
necessários,O,I-OBRIGACAO,0.2183443739057029,608,"adotar os procedimentos necessários à execução, especialmente"
especialmente,O,I-OBRIGACAO,0.2183443739057029,608,"necessários à execução, especialmente o disposto nos"
do,O,I-OBRIGACAO,0.2183443739057029,726,ao atual Chefe do Poder Executivo para
Lei,O,I-OBRIGACAO,0.2183443739057029,608,"inciso I, da Lei Complementar Estadual n.º"
n.º,O,I-OBRIGACAO,0.2183443739057029,608,Lei Complementar Estadual n.º 464/2012.
da,O,I-OBRIGACAO,0.2183443739057029,230,função do descumprimento da medida cautelar deferida;
464/2012.,O,I-OBRIGACAO,0.2183443739057029,850,Complementar Estadual nº 464/2012.
Estadual,O,I-OBRIGACAO,0.2183443739057029,850,da Lei Complementar Estadual nº 464/2012.
pela,O,I-OBRIGACAO,0.2183443739057029,230,cautelar deferida; ix) pela determinação à Diretoria
Lei,O,I-OBRIGACAO,0.2183443739057029,850,"inciso I, da Lei Complementar Estadual nº"
Francisco,O,I-OBRIGACAO,0.2183443739057029,223,"Oliveira e Sr. Francisco Juraci Leite, respectivamente,"
permanecem,O,I-OBRIGACAO,0.2183443739057029,82,"inconformidades e impropriedades permanecem caracterizadas e ensejam,"
Expedientes,O,I-OBRIGACAO,0.2183443739057029,230,"de Atos e Expedientes - DAE, para"
e,O,I-OBRIGACAO,0.2183443739057029,82,as demais inconformidades e impropriedades permanecem caracterizadas
ao,O,I-OBRIGACAO,0.2183443739057029,82,"de Lucrécia, atinentes ao exercício de 2014,"
DAP,O,I-OBRIGACAO,0.2183443739057029,594,"de Pessoal - DAP que monitore, ainda,"
que,O,I-OBRIGACAO,0.2183443739057029,594,"Pessoal - DAP que monitore, ainda, o"
cumprimento,O,I-OBRIGACAO,0.2183443739057029,594,"monitore, ainda, o cumprimento de todos os"
da,O,I-OBRIGACAO,0.2183443739057029,230,"vi) pela confirmação da determinação para, no"
com,O,I-OBRIGACAO,0.2183443739057029,852,"Ademais, em discordância com o Corpo Técnico"
imediatamente,O,I-OBRIGACAO,0.2183443739057029,594,x) por representar imediatamente ao Ministério Público
de,O,I-OBRIGACAO,0.2183443739057029,84,valor do Saldo de Caixa e Equivalentes
de,O,I-OBRIGACAO,0.2183443739057029,852,"sem a interposição de recurso, deverá a"
e,O,I-OBRIGACAO,0.2183443739057029,852,o Corpo Técnico e com o Ministério
Público,O,I-OBRIGACAO,0.2183443739057029,852,"com o Ministério Público de Contas, pelo"
determinação,O,I-OBRIGACAO,0.2183443739057029,230,deferida; ix) pela determinação à Diretoria de
de,O,I-OBRIGACAO,0.2183443739057029,852,"o Ministério Público de Contas, pelo afastamento"
para,O,I-OBRIGACAO,0.2183443739057029,852,Municipal de Goianinha/RN para decisão. Transcorrido o
apuração,O,I-OBRIGACAO,0.2183443739057029,594,para fins de apuração da prática de
Câmara,O,I-OBRIGACAO,0.2183443739057029,852,"2010, submetendo-o à Câmara Municipal de Goianinha/RN"
de,O,I-OBRIGACAO,0.2183443739057029,852,"135, de 4 de junho de 2010,"
4,O,I-OBRIGACAO,0.2183443739057029,852,"Complementar 135, de 4 de junho de"
Equivalentes,O,I-OBRIGACAO,0.2183443739057029,84,de Caixa e Equivalentes de Caixa informado
aplicação,O,I-OBRIGACAO,0.2183443739057029,230,"1.000,00; vii) pela aplicação da multa no"
"135,",O,I-OBRIGACAO,0.2183443739057029,852,"pela Lei Complementar 135, de 4 de"
Contas,O,I-OBRIGACAO,0.2183443739057029,82,pela desaprovação das Contas de Governo em
as,O,I-OBRIGACAO,0.2183443739057029,82,"2014, dado que as demais inconformidades e"
de,O,I-OBRIGACAO,0.2183443739057029,230,determinação à Diretoria de Atos e Expedientes
afastamento,O,I-OBRIGACAO,0.2183443739057029,852,"de Contas, pelo afastamento das irregularidades formais"
da,O,I-OBRIGACAO,0.2183443739057029,850,"118, inciso I, da Lei Complementar Estadual"
indicado.,O,I-OBRIGACAO,0.2183443739057029,223,"parte do responsável indicado. Intimem-se os responsáveis,"
que,O,I-OBRIGACAO,0.2183443739057029,230,"Pessoal - DDP que monitore, ainda, o"
HONÓRIO,O,I-OBRIGACAO,0.2183443739057029,852,Sr. RUDSON RAIMUNDO HONÓRIO LISBOA na lista
do,O,I-OBRIGACAO,0.2183443739057029,830,à Procuradoria Geral do Estado e ao
a,O,I-OBRIGACAO,0.2183443739057029,830,ao Ministério Público a fim de apurar
§,O,I-OBRIGACAO,0.2183443739057029,830,"no art. 29-A, § 3°, da Constituição"
"Júnior,",O,I-OBRIGACAO,0.2183443739057029,830,"gestor, José Menezes Júnior, responsável pelo RGF"
alterado,O,I-OBRIGACAO,0.2183443739057029,852,"maio de 1990, alterado pela Lei Complementar"
termos,O,I-OBRIGACAO,0.2183443739057029,830,"2º semestre/2010, nos termos do art. %%,"
"irregulares,",O,I-OBRIGACAO,0.2183443739057029,830,"as contas como irregulares, conforme art. 78,"
de,O,I-OBRIGACAO,0.2183443739057029,852,"18 de maio de 1990, alterado pela"
partes,O,I-OBRIGACAO,0.2183443739057029,849,"a liquidação, as partes sejam intimadas para,"
após,O,I-OBRIGACAO,0.2183443739057029,849,"ressarcidos. E, apenas após a liquidação, as"
seu,O,I-OBRIGACAO,0.2183443739057029,495,Corte certificar o seu trânsito em julgado
da,O,I-OBRIGACAO,0.2183443739057029,830,"%%, § 21º, da LRF: a) Aplicação"
remessa,O,I-OBRIGACAO,0.2183443739057029,778,121/94; e) Pela remessa de cópia autenticada
autenticada,O,I-OBRIGACAO,0.2183443739057029,778,remessa de cópia autenticada do presente processo
ao,O,I-OBRIGACAO,0.2183443739057029,778,"do presente processo ao Ministério Público Estadual,"
para,O,I-OBRIGACAO,0.2183443739057029,778,"Ministério Público Estadual, para apuração de eventuais"
serem,O,I-OBRIGACAO,0.2183443739057029,849,"dos valores a serem ressarcidos. E, apenas"
eventuais,O,I-OBRIGACAO,0.2183443739057029,778,para apuração de eventuais infrações penais e/ou
atos,O,I-OBRIGACAO,0.2183443739057029,778,"infrações penais e/ou atos de improbidade administrativa,"
liquidação,O,I-OBRIGACAO,0.2183443739057029,849,com Pessoal para liquidação dos valores a
Pessoal,O,I-OBRIGACAO,0.2183443739057029,849,de Despesa com Pessoal para liquidação dos
de,O,I-OBRIGACAO,0.2183443739057029,778,aquisição de polpas de frutas; de R$
(cinquenta,O,I-OBRIGACAO,0.2183443739057029,778,"de R$ 55.000,00 (cinquenta e cinco mil"
para,O,I-OBRIGACAO,0.2183443739057029,852,à Justiça Eleitoral para os fins do
Sr.,O,I-OBRIGACAO,0.2183443739057029,852,o nome do Sr. RUDSON RAIMUNDO HONÓRIO
maio,O,I-OBRIGACAO,0.2183443739057029,852,"de 18 de maio de 1990, alterado"
disposto,O,I-OBRIGACAO,0.2183443739057029,495,"execução, especialmente o disposto nos arts. 117"
representar,O,I-OBRIGACAO,0.2183443739057029,230,Decisão; x) por representar imediatamente ao Ministério
para,O,I-OBRIGACAO,0.2183443739057029,230,Ministério Público Estadual para fins de apuração
cumprimento,O,I-OBRIGACAO,0.2183443739057029,230,"monitore, ainda, o cumprimento de todos os"
comandos,O,I-OBRIGACAO,0.2183443739057029,230,de todos os comandos desta Decisão; x)
Estadual,O,I-OBRIGACAO,0.2183443739057029,495,da Lei Complementar Estadual nº 464/2012.
imediatamente,O,I-OBRIGACAO,0.2183443739057029,230,x) por representar imediatamente ao Ministério Público
e,O,I-OBRIGACAO,0.2183443739057029,850,"nos arts. 117 e 118, inciso I,"
