token,label_original,label_sugerido,confianca,sentenca_idx,contexto
multa,I-MULTA,B-OBRIGACAO,0.25106249632279465,527,"do valor da multa máxima vigente, e"
correspondente,I-MULTA,B-OBRIGACAO,0.25106249632279465,527,"da Res. 009/2012-TCE, correspondente a 30% (trinta"
no,I-MULTA,B-OBRIGACAO,0.25106249632279465,778,aplicação de multa no percentual de 30%
listadas,I-MULTA,B-OBRIGACAO,0.25106249632279465,778,"por danos materiais, listadas no item anterior,"
"anterior,",I-MULTA,B-OBRIGACAO,0.25106249632279465,778,"listadas no item anterior, nos termos do"
"102,",I-MULTA,B-OBRIGACAO,0.25106249632279465,778,"termos do art. 102, inciso I, da"
inciso,I-MULTA,B-OBRIGACAO,0.25106249632279465,778,"do art. 102, inciso I, da Lei"
nº,I-MULTA,B-OBRIGACAO,0.25106249632279465,778,da Lei Complementar nº 121/94; e) Pela
"4.320,00",I-MULTA,B-OBRIGACAO,0.25106249632279465,830,"de R$ R$ 4.320,00 (quatro mil, trezentos"
"mil,",I-MULTA,B-OBRIGACAO,0.25106249632279465,830,"R$ 4.320,00 (quatro mil, trezentos e vinte"
trezentos,I-MULTA,B-OBRIGACAO,0.25106249632279465,830,"4.320,00 (quatro mil, trezentos e vinte reais),"
conforme,I-MULTA,B-OBRIGACAO,0.25106249632279465,830,"e vinte reais), conforme art. 26, I"
art.,I-MULTA,B-OBRIGACAO,0.25106249632279465,830,"vinte reais), conforme art. 26, I da"
nº,I-MULTA,B-OBRIGACAO,0.25106249632279465,830,"I da Resolução nº 12/2007-TCE, pelo atraso"
pelo,I-MULTA,B-OBRIGACAO,0.25106249632279465,830,"Resolução nº 12/2007-TCE, pelo atraso da publicação"
até,I-MULTA,B-OBRIGACAO,0.25106249632279465,830,"valor total de até 1.000,00 (um mil)"
valor,I-MULTA,B-OBRIGACAO,0.25106249632279465,830,de multa no valor total de até
exercício,I-MULTA,B-OBRIGACAO,0.25106249632279465,830,do RGF do exercício 2010 (2º semestre);
do,I-MULTA,B-OBRIGACAO,0.25106249632279465,830,publicação do RGF do exercício 2010 (2º
comprovação,I-MULTA,B-OBRIGACAO,0.25106249632279465,830,na remessa da comprovação da publicação do
na,I-MULTA,B-OBRIGACAO,0.25106249632279465,830,"12/2007-TCE/RN, pelo atraso na remessa da comprovação"
",",I-MULTA,B-OBRIGACAO,0.25106249632279465,527,"024/2024 – GP/TCE , de 19 de"
atraso,I-MULTA,B-OBRIGACAO,0.25106249632279465,830,"nº 12/2007-TCE/RN, pelo atraso na remessa da"
da,I-MULTA,B-OBRIGACAO,0.25106249632279465,830,"“a”, item 5 da Resolução nº 12/2007-TCE/RN,"
item,I-MULTA,B-OBRIGACAO,0.25106249632279465,830,"I, alínea “a”, item 5 da Resolução"
art.,I-MULTA,B-OBRIGACAO,0.25106249632279465,830,"mil reais), conforme art. 28, I, alínea"
de,I-MULTA,B-OBRIGACAO,0.25106249632279465,830,"no valor total de R$ 1.000,00 (um"
RGF,I-MULTA,B-OBRIGACAO,0.25106249632279465,830,da publicação do RGF do exercício 2010
da,I-MULTA,B-OBRIGACAO,0.25106249632279465,830,"12/2007-TCE, pelo atraso da publicação do RGF"
"107,",I-MULTA,B-OBRIGACAO,0.25106249632279465,337,"e no art. 107, II, b, da"
Fiscais,I-MULTA,B-OBRIGACAO,0.25106249632279465,830,(um mil) Unidades Fiscais de Referência do
de,I-MULTA,B-OBRIGACAO,0.25106249632279465,527,"– GP/TCE , de 19 de janeiro"
janeiro,I-MULTA,B-OBRIGACAO,0.25106249632279465,527,"de 19 de janeiro de 2024, diante"
comandos,I-MULTA,B-OBRIGACAO,0.25106249632279465,594,dois dos quatro comandos nela presentes; vii)
"289/2022,",I-MULTA,B-OBRIGACAO,0.25106249632279465,594,"no Acórdão n.º 289/2022, em dois dos"
Acórdão,I-MULTA,B-OBRIGACAO,0.25106249632279465,594,"cautelar contida no Acórdão n.º 289/2022, em"
medida,I-MULTA,B-OBRIGACAO,0.25106249632279465,594,pelo descumprimento da medida cautelar contida no
Prefeita,I-MULTA,B-OBRIGACAO,0.25106249632279465,594,"mil reais) à Prefeita Municipal, Sra. Hosanira"
reais),I-MULTA,B-OBRIGACAO,0.25106249632279465,594,"e cinco mil reais) à Prefeita Municipal,"
mil,I-MULTA,B-OBRIGACAO,0.25106249632279465,594,(cinquenta e cinco mil reais) à Prefeita
cinco,I-MULTA,B-OBRIGACAO,0.25106249632279465,594,"55.000,00 (cinquenta e cinco mil reais) à"
e,I-MULTA,B-OBRIGACAO,0.25106249632279465,594,"R$ 55.000,00 (cinquenta e cinco mil reais)"
"55.000,00",I-MULTA,B-OBRIGACAO,0.25106249632279465,594,"valor de R$ 55.000,00 (cinquenta e cinco"
no,I-MULTA,B-OBRIGACAO,0.25106249632279465,830,Aplicação de multa no valor total de
de,I-MULTA,B-OBRIGACAO,0.25106249632279465,830,no valor total de até 100% (cem
até,I-MULTA,B-OBRIGACAO,0.25106249632279465,830,valor total de até 100% (cem por
débito,I-MULTA,B-OBRIGACAO,0.25106249632279465,830,"do valor do débito imputado ao responsável,"
"78,",I-MULTA,B-OBRIGACAO,0.25106249632279465,830,"responsável, conforme art. 78, §3. º, “a”"
"102,",I-MULTA,B-OBRIGACAO,0.25106249632279465,830,"º, “a” c/c 102, I da Lei"
da,I-MULTA,B-OBRIGACAO,0.25106249632279465,830,"c/c 102, I da Lei Complementar n.º"
da,I-MULTA,B-OBRIGACAO,0.25106249632279465,527,diante do descumprimento da Lei de Responsabilidade
de,I-MULTA,B-OBRIGACAO,0.25106249632279465,527,"descumprimento da Lei de Responsabilidade Fiscal, visto"
Lei,I-MULTA,B-OBRIGACAO,0.25106249632279465,527,"ordenamento jurídico a Lei Municipal nº 3396/2016,"
nº,I-MULTA,B-OBRIGACAO,0.25106249632279465,527,"a Lei Municipal nº 3396/2016, ser ter"
da,I-MULTA,B-OBRIGACAO,0.25106249632279465,527,"ter exigido, quando da instrução do Projeto"
instrução,I-MULTA,B-OBRIGACAO,0.25106249632279465,527,"exigido, quando da instrução do Projeto de"
de,I-MULTA,B-OBRIGACAO,0.25106249632279465,527,", de 19 de janeiro de 2024,"
"Lei,",I-MULTA,B-OBRIGACAO,0.25106249632279465,527,"do Projeto de Lei, documentos técnicos essenciais,"
"sejam,",I-MULTA,B-OBRIGACAO,0.25106249632279465,527,"técnicos essenciais, quais sejam, os estabelecidos nos"
I,I-MULTA,B-OBRIGACAO,0.25106249632279465,527,"nos arts. 16, I e II, §2º,"
"II,",I-MULTA,B-OBRIGACAO,0.25106249632279465,527,"16, I e II, §2º, e 17,"
da,I-MULTA,B-OBRIGACAO,0.25106249632279465,527,§§1º e 2º da Lei de Responsabilidade
Responsabilidade,I-MULTA,B-OBRIGACAO,0.25106249632279465,527,da Lei de Responsabilidade Fiscal.
(Lei,I-MULTA,B-OBRIGACAO,0.25106249632279465,830,Complementar n.º 121/1994 (Lei Orgânica do TCE/RN);
técnicos,I-MULTA,B-OBRIGACAO,0.25106249632279465,527,"de Lei, documentos técnicos essenciais, quais sejam,"
de,I-MULTA,B-OBRIGACAO,0.25106249632279465,830,mil) Unidades Fiscais de Referência do Rio
pelo,I-MULTA,B-OBRIGACAO,0.25106249632279465,830,"Resolução nº 12/2007-TCE/RN, pelo atraso na remessa"
a,I-MULTA,B-OBRIGACAO,0.25106249632279465,830,"unidade que venha a ser instituída, conforme"
Lei,I-MULTA,B-OBRIGACAO,0.25106249632279465,337,"5°, §1°, da Lei Federal n° 10.028/2000"
R$,I-MULTA,B-OBRIGACAO,0.25106249632279465,835,"no valor de R$ 500,00 (quinhentos reais),"
(quinhentos,I-MULTA,B-OBRIGACAO,0.25106249632279465,835,"de R$ 500,00 (quinhentos reais), pela celebração"
de,I-MULTA,B-OBRIGACAO,0.25106249632279465,835,"k)multa no valor de R$ 500,00 (quinhentos"
indicação,I-MULTA,B-OBRIGACAO,0.25106249632279465,835,terreno sem a indicação dos critérios para
critérios,I-MULTA,B-OBRIGACAO,0.25106249632279465,835,a indicação dos critérios para se chegar
unidade,I-MULTA,B-OBRIGACAO,0.25106249632279465,830,"(UFIRN), ou outra unidade que venha a"
464/2012;,I-MULTA,B-OBRIGACAO,0.25106249632279465,337,"da LCE n.º 464/2012; ii. R$ 9.600,00"
Complementar,I-MULTA,B-OBRIGACAO,0.25106249632279465,849,"e, da Lei Complementar Estadual nº 464/2012;"
"5.000,00",I-MULTA,B-OBRIGACAO,0.25106249632279465,849,"multa de R$ 5.000,00 (cinco mil reais)"
(cinco,I-MULTA,B-OBRIGACAO,0.25106249632279465,849,"de R$ 5.000,00 (cinco mil reais) ao"
"Medeiros,",I-MULTA,B-OBRIGACAO,0.25106249632279465,849,"Josifran Lins de Medeiros, pelo descumprimento do"
mil,I-MULTA,B-OBRIGACAO,0.25106249632279465,337,"R$ 9.600,00 (nove mil e seiscentos reais),"
de,I-MULTA,B-OBRIGACAO,0.25106249632279465,835,"j)multa no valor de R$ 500,00 (quinhentos"
descumprimento,I-MULTA,B-OBRIGACAO,0.25106249632279465,849,"de Medeiros, pelo descumprimento do artigo 21"
da,I-MULTA,B-OBRIGACAO,0.25106249632279465,849,"do artigo 21 da LRF, nos termos"
"LRF,",I-MULTA,B-OBRIGACAO,0.25106249632279465,849,"artigo 21 da LRF, nos termos do"
de,I-MULTA,B-OBRIGACAO,0.25106249632279465,337,"equivalente a 5% de seu subsídio anual,"
nos,I-MULTA,B-OBRIGACAO,0.25106249632279465,849,"21 da LRF, nos termos do artigo"
"107,",I-MULTA,B-OBRIGACAO,0.25106249632279465,849,"termos do artigo 107, inciso II, b,"
inciso,I-MULTA,B-OBRIGACAO,0.25106249632279465,849,"do artigo 107, inciso II, b, da"
"II,",I-MULTA,B-OBRIGACAO,0.25106249632279465,849,"artigo 107, inciso II, b, da Lei"
da,I-MULTA,B-OBRIGACAO,0.25106249632279465,849,"inciso II, b, da Lei Orgânica do"
termos,I-MULTA,B-OBRIGACAO,0.25106249632279465,337,"2º semestre, nos termos do art. 5°,"
–,I-MULTA,B-OBRIGACAO,0.25106249632279465,337,"Resolução n° 022/2011 – TCE; Ainda, no"
Resolução,I-MULTA,B-OBRIGACAO,0.25106249632279465,337,"inciso I, da Resolução n° 022/2011 –"
da,I-MULTA,B-OBRIGACAO,0.25106249632279465,337,"26, inciso I, da Resolução n° 022/2011"
Federal,I-MULTA,B-OBRIGACAO,0.25106249632279465,337,"§1°, da Lei Federal n° 10.028/2000 e"
do,I-MULTA,B-OBRIGACAO,0.25106249632279465,849,"Medeiros, pelo descumprimento do artigo 21 da"
no,I-MULTA,B-OBRIGACAO,0.25106249632279465,835,execução contratual; j)multa no valor de R$
"5°,",I-MULTA,B-OBRIGACAO,0.25106249632279465,337,"termos do art. 5°, §1°, da Lei"
unidade,I-MULTA,B-OBRIGACAO,0.25106249632279465,830,"(UFIRN), ou outra unidade que venha a"
Referência,I-MULTA,B-OBRIGACAO,0.25106249632279465,830,Unidades Fiscais de Referência do Rio Grande
Rio,I-MULTA,B-OBRIGACAO,0.25106249632279465,830,de Referência do Rio Grande do Norte
Grande,I-MULTA,B-OBRIGACAO,0.25106249632279465,830,"Referência do Rio Grande do Norte (UFIRN),"
do,I-MULTA,B-OBRIGACAO,0.25106249632279465,830,"do Rio Grande do Norte (UFIRN), ou"
Relatório,I-MULTA,B-OBRIGACAO,0.25106249632279465,830,da publicação do Relatório de Gestão Fiscal
de,I-MULTA,B-OBRIGACAO,0.25106249632279465,802,"do 3º quadrimestres de 2010, conforme preleciona"
contratual;,I-MULTA,B-OBRIGACAO,0.25106249632279465,835,prazo de execução contratual; j)multa no valor
"instituída,",I-MULTA,B-OBRIGACAO,0.25106249632279465,830,"venha a ser instituída, conforme art. 102,"
Complementar,I-MULTA,B-OBRIGACAO,0.25106249632279465,830,"“a” da Lei Complementar n.º 121/1994, pelo"
"121/1994,",I-MULTA,B-OBRIGACAO,0.25106249632279465,830,"Lei Complementar n.º 121/1994, pelo atraso na"
da,I-MULTA,B-OBRIGACAO,0.25106249632279465,830,atraso na remessa da comprovação da publicação
Fiscais,I-MULTA,B-OBRIGACAO,0.25106249632279465,830,(um mil) Unidades Fiscais de Referência do
do,I-MULTA,B-OBRIGACAO,0.25106249632279465,830,atraso da publicação do Relatório de Gestão
"fim,",I-MULTA,B-OBRIGACAO,0.25106249632279465,830,"(2º semestre). Por fim, no sentido de"
Egrégia,I-MULTA,B-OBRIGACAO,0.25106249632279465,830,de que esta Egrégia Corte promova a
"121/1994,",I-MULTA,B-OBRIGACAO,0.25106249632279465,830,"Lei Complementar n.º 121/1994, pelo atraso da"
na,I-MULTA,B-OBRIGACAO,0.25106249632279465,830,a recomendação sugerida na manifestação do Parquet
Parquet,I-MULTA,B-OBRIGACAO,0.25106249632279465,830,"na manifestação do Parquet de Contas, qual"
do,I-MULTA,B-OBRIGACAO,0.25106249632279465,830,envio por cópia do processo ao Ministério
ao,I-MULTA,B-OBRIGACAO,0.25106249632279465,830,cópia do processo ao Ministério Público Estadual.
Público,I-MULTA,B-OBRIGACAO,0.25106249632279465,830,processo ao Ministério Público Estadual.
Complementar,I-MULTA,B-OBRIGACAO,0.25106249632279465,830,"“a” da Lei Complementar n.º 121/1994, pelo"
conforme,I-MULTA,B-OBRIGACAO,0.25106249632279465,830,"a ser instituída, conforme art. 102, II,"
R$,I-MULTA,B-OBRIGACAO,0.25106249632279465,835,"no valor de R$ 500,00 (quinhentos reais),"
prazo,I-MULTA,B-OBRIGACAO,0.25106249632279465,835,pelo descumprimento de prazo de execução contratual;
semestre).,I-MULTA,B-OBRIGACAO,0.25106249632279465,830,"exercício 2010 (2º semestre). Por fim, no"
Unidades,I-MULTA,B-OBRIGACAO,0.25106249632279465,830,"1.000,00 (um mil) Unidades Fiscais de Referência"
"012/2016,",O,I-MULTA,0.8660295070052829,716,"referida Resolução n° 012/2016, em razão do"
fim,O,I-RECOMENDACAO,0.5316931582790521,685,de procedimentos a fim de que realize
Silva,O,I-RESSARCIMENTO,0.84914632571196,807,Emanoel Fagundes da Silva (fiscal); Fausto Andrade
recomendação,B-RECOMENDACAO,I-RECOMENDACAO,0.5624111046903668,398,do Município; Pela recomendação aos Chefes dos
das,O,I-RECOMENDACAO,0.8116127427967652,685,caráter continuado decorrente das nomeações de pessoal;
morte,O,I-OBRIGACAO,0.8445938107161508,202,de pensão por morte a esta Corte
de,O,I-OBRIGACAO,0.8091967202188998,629,"fazer nela constar, de forma discriminada, cada"
de,O,I-OBRIGACAO,0.8497898419139542,628,que a imposição de possíveis sanções administrativas
Interno,I-OBRIGACAO,I-MULTA,0.8575523739471649,336,do Novel Regimento Interno desta Casa.
"intercorrente,",O,I-RECOMENDACAO,0.8525690688815462,767,"ocorrência de prescrição intercorrente, como no presente"
com,O,I-RESSARCIMENTO,0.6423708776786713,807,"Constituição Federal combinado com o artigo 78,"
(quinhentos,I-OBRIGACAO,I-MULTA,0.8088414598801367,495,"de R$ 500,00 (quinhentos reais) por cada"
a,O,I-RECOMENDACAO,0.8484333403920301,212,vistas a impedir a consumação de prescrição
"121/1994,",O,I-RESSARCIMENTO,0.7634471864348016,792,"da LCE n.º 121/1994, pela extrapolação do"
Técnicas,O,I-RECOMENDACAO,0.8456145857631365,305,prescrição nas Unidades Técnicas a ela vinculadas.
"006,",I-RESSARCIMENTO,I-MULTA,0.8173714875636505,836,"nº 001, 028, 006, 091, 121, 150"
vistas,O,I-RECOMENDACAO,0.8457238387602194,236,adote procedimentos com vistas a impedir a
forma,I-RECOMENDACAO,I-OBRIGACAO,0.8207364506830309,543,"indicadores estratégicos, de forma a permitir o"
DECIDE,B-OBRIGACAO,I-OBRIGACAO,0.6284140323643592,522,"II, da LOTCE/RN; DECIDE também, pela representação"
NOTIFICAÇÃO,O,I-OBRIGACAO,0.6376238455723479,202,regimental. c) pela NOTIFICAÇÃO ao Instituto de
"R$5.897,95",I-MULTA,I-RESSARCIMENTO,0.8416285673369661,223,"na quantia de R$5.897,95 (cinco mil oitocentos"
e,O,I-OBRIGACAO,0.8047221880649735,250,"planos de cargos e salários. Por fim,"
Municipal,O,I-MULTA,0.8122716423847725,830,"Presidente da Câmara Municipal de São Tomé,"
ressarcimento,B-RESSARCIMENTO,I-RESSARCIMENTO,0.7987877820776302,828,de Contas; 2.o ressarcimento ao erário municipal
em,O,I-RECOMENDACAO,0.5258429741046678,685,nomeações dos cargos em integral cumprimento dos
"Contas,",O,I-RECOMENDACAO,0.8466722249367018,212,"desta Corte de Contas, que adote procedimentos"
"001,",I-RESSARCIMENTO,I-MULTA,0.8125644584814465,836,"dos empenhos nº 001, 028, 006, 091,"
imediata,B-OBRIGACAO,B-RECOMENDACAO,0.20929914269933345,608,011/2016-TC; 3) pela imediata remessa de cópia
determinação,B-OBRIGACAO,B-RECOMENDACAO,0.20929914269933345,495,"h) quanto à determinação acima (item g),"
representar,B-OBRIGACAO,B-RECOMENDACAO,0.20929914269933345,495,mora; k) por representar imediatamente ao Ministério
medida,B-OBRIGACAO,B-RECOMENDACAO,0.20929914269933345,594,pela confirmação da medida de proibição ao
"102,",I-RESSARCIMENTO,I-OBRIGACAO,0.6566590869656893,786,"deste débito (art. 102, I da LC"
a,O,I-RECOMENDACAO,0.8439713688943377,236,"nas Unidades Técnicas a ela vinculadas. Ainda,"
citação;,I-RESSARCIMENTO,I-OBRIGACAO,0.7588054723486978,849,data da sua citação; d) imposição aos
04/2013-TCE.,O,I-MULTA,0.8589630962719341,196,"da Resolução nº 04/2013-TCE. Por fim, em"
no,I-MULTA,I-OBRIGACAO,0.2183443739057029,337,"nº 022/2011-TCE e no art. 107, II,"
022/2011-TCE,I-MULTA,I-OBRIGACAO,0.2183443739057029,337,da Resolução nº 022/2011-TCE e no art.
inciso,I-MULTA,I-OBRIGACAO,0.2183443739057029,337,"no art. 28, inciso I, alínea “a”,"
"28,",I-MULTA,I-OBRIGACAO,0.2183443739057029,337,"prevista no art. 28, inciso I, alínea"
no,I-MULTA,I-OBRIGACAO,0.2183443739057029,337,"na forma prevista no art. 28, inciso"
atraso,I-MULTA,I-OBRIGACAO,0.2183443739057029,337,"(trezentos reais), pelo atraso na publicação do"
inseriu,I-MULTA,I-OBRIGACAO,0.2183443739057029,527,"Fiscal, visto que inseriu no ordenamento jurídico"
121/94;,I-MULTA,I-OBRIGACAO,0.2183443739057029,778,Lei Complementar nº 121/94; e) Pela remessa
"materiais,",I-MULTA,I-OBRIGACAO,0.2183443739057029,778,"condenações por danos materiais, listadas no item"
art.,I-MULTA,I-OBRIGACAO,0.2183443739057029,337,"022/2011-TCE e no art. 107, II, b,"
ordenamento,I-MULTA,I-OBRIGACAO,0.2183443739057029,527,que inseriu no ordenamento jurídico a Lei
Projeto,I-MULTA,I-OBRIGACAO,0.2183443739057029,527,"da instrução do Projeto de Lei, documentos"
(cem,I-MULTA,I-OBRIGACAO,0.2183443739057029,830,de até 100% (cem por cento) do
total,I-MULTA,I-OBRIGACAO,0.2183443739057029,830,multa no valor total de até 100%
Hosanira,I-MULTA,I-OBRIGACAO,0.2183443739057029,594,"Prefeita Municipal, Sra. Hosanira Galvão, e ao"
no,I-MULTA,I-OBRIGACAO,0.2183443739057029,527,visto que inseriu no ordenamento jurídico a
da,I-MULTA,I-OBRIGACAO,0.2183443739057029,337,"107, II, b, da LCE n.º 464/2012;"
na,I-MULTA,I-OBRIGACAO,0.2183443739057029,802,reais) pela desídia na remessa do comprovante
art.,I-MULTA,I-OBRIGACAO,0.2183443739057029,337,"n° 10.028/2000 e art. 26, inciso I,"
para,I-MULTA,I-OBRIGACAO,0.2183443739057029,835,indicação dos critérios para se chegar ao
sem,I-MULTA,I-OBRIGACAO,0.2183443739057029,835,desapropriação de terreno sem a indicação dos
Fiscal,I-MULTA,I-OBRIGACAO,0.2183443739057029,802,Relatório de Gestão Fiscal do 3º quadrimestres
Ministério,I-MULTA,I-OBRIGACAO,0.2183443739057029,830,do processo ao Ministério Público Estadual.
"seja,",I-MULTA,I-OBRIGACAO,0.2183443739057029,830,"de Contas, qual seja, do envio por"
sentido,I-MULTA,I-OBRIGACAO,0.2183443739057029,830,"Por fim, no sentido de que esta"
Por,I-MULTA,I-OBRIGACAO,0.2183443739057029,830,"2010 (2º semestre). Por fim, no sentido"
outra,I-MULTA,I-OBRIGACAO,0.2183443739057029,830,"Norte (UFIRN), ou outra unidade que venha"
e,I-MULTA,I-OBRIGACAO,0.2183443739057029,337,"Federal n° 10.028/2000 e art. 26, inciso"
121/94;,I-MULTA,I-OBRIGACAO,0.2183443739057029,820,Lei Complementar nº 121/94;
ou,I-MULTA,I-OBRIGACAO,0.2183443739057029,830,"do Norte (UFIRN), ou outra unidade que"
"1.000,00",I-MULTA,I-OBRIGACAO,0.2183443739057029,830,"total de até 1.000,00 (um mil) Unidades"
5,I-MULTA,I-OBRIGACAO,0.2183443739057029,830,"alínea “a”, item 5 da Resolução nº"
"“a”,",I-MULTA,I-OBRIGACAO,0.2183443739057029,830,"28, I, alínea “a”, item 5 da"
"reais),",I-MULTA,I-OBRIGACAO,0.2183443739057029,830,"1.000,00 (um mil reais), conforme art. 28,"
TCE;,I-MULTA,I-OBRIGACAO,0.2183443739057029,337,"n° 022/2011 – TCE; Ainda, no sentido"
inciso,I-MULTA,I-OBRIGACAO,0.2183443739057029,337,"e art. 26, inciso I, da Resolução"
ao,I-MULTA,I-OBRIGACAO,0.2183443739057029,594,"Hosanira Galvão, e ao Município de Goianinha,"
outra,I-MULTA,I-OBRIGACAO,0.2183443739057029,830,"Norte (UFIRN), ou outra unidade que venha"
"26,",I-MULTA,I-OBRIGACAO,0.2183443739057029,337,"10.028/2000 e art. 26, inciso I, da"
Lei,I-MULTA,I-OBRIGACAO,0.2183443739057029,527,e 2º da Lei de Responsabilidade Fiscal.
item,I-MULTA,I-OBRIGACAO,0.2183443739057029,802,"28, I, “a”, item 3 da Resolução"
razão,I-MULTA,I-OBRIGACAO,0.2183443739057029,799,razão do atraso razão do atraso na
de,I-MULTA,I-OBRIGACAO,0.2183443739057029,799,"multa no valor de R$ 1.000,00 (mil"
atraso,I-MULTA,I-OBRIGACAO,0.2183443739057029,799,atraso razão do atraso na remessa do
de,I-MULTA,I-OBRIGACAO,0.2183443739057029,799,remessa do comprovante de publicação dos RGF
do,I-MULTA,I-OBRIGACAO,0.2183443739057029,799,publicação dos RGF do 2° semestre de
"“5”,",I-MULTA,I-OBRIGACAO,0.2183443739057029,799,"28, “a”, item “5”, da Resolução nº"
012/2007;,I-MULTA,I-OBRIGACAO,0.2183443739057029,799,da Resolução nº 012/2007; b.3) pela aplicação
no,I-MULTA,I-OBRIGACAO,0.2183443739057029,799,aplicação de multa no valor de R$
"reais),",I-MULTA,I-OBRIGACAO,0.2183443739057029,799,"R$ 1.000,00 (mil reais), em razão do"
no,I-MULTA,I-OBRIGACAO,0.2183443739057029,594,"medida cautelar contida no Acórdão n.º 289/2022,"
"600,00",I-MULTA,I-OBRIGACAO,0.2183443739057029,802,"quantia de R$ 600,00 (seiscentos reais) pelo"
"5,",I-MULTA,I-OBRIGACAO,0.2183443739057029,802,"I, “a”, item 5, da Resolução nº."
TCE;,I-MULTA,I-OBRIGACAO,0.2183443739057029,802,nº. 012/2007 – TCE; Concluída a execução
de,I-MULTA,I-OBRIGACAO,0.2183443739057029,802,"ao 3º quadrimestres de 2010, com fulcro"
R$,I-MULTA,I-OBRIGACAO,0.2183443739057029,802,"no montante de R$ 1.000,00 (mil reais)"
valor,I-MULTA,I-OBRIGACAO,0.2183443739057029,799,"de multa no valor de R$ 450,00"
com,O,I-RECOMENDACAO,0.8424960696266737,236,que adote procedimentos com vistas a impedir
respondendo,I-RESSARCIMENTO,I-OBRIGACAO,0.7710264028650441,849,"partir de 14/12/2017, respondendo cada beneficiário de"
90,O,I-OBRIGACAO,0.8343477095269145,692,"prazo de até 90 (noventa) dias úteis,"
Decisum,O,I-OBRIGACAO,0.8189464595030205,628,"pelo descumprimento do Decisum nele proferido, uma"
Recomendar,B-RECOMENDACAO,I-RECOMENDACAO,0.5480715034872355,172,Complementar nº 464/2012. Recomendar a Secretaria de
desfavor,O,I-RESSARCIMENTO,0.7207204018105497,807,"forma solidária, em desfavor de Emanoel Fagundes"
que,O,I-RECOMENDACAO,0.8396305293923056,305,"Corte de Contas, que adote procedimentos com"
Recomendar,B-RECOMENDACAO,I-RECOMENDACAO,0.6454923555129698,254,Complementar nº 464/2012. Recomendar à Secretaria de
Corte,O,I-RECOMENDACAO,0.838067141588102,247,"– SECEX desta Corte de Contas, que"
Técnicas,O,I-RECOMENDACAO,0.837122033646893,236,prescrição nas Unidades Técnicas a ela vinculadas.
com,O,I-RECOMENDACAO,0.5466968287724856,685,"e legais aplicáveis, com vistas a assegurar"
"(LOTCE/RN,",I-OBRIGACAO,I-MULTA,0.8245191291155319,495,"contrato irregular mantido (LOTCE/RN, art. 110), até"
nas,O,I-RECOMENDACAO,0.8392112417054132,236,consumação de prescrição nas Unidades Técnicas a
e,O,I-OBRIGACAO,0.8425558517239148,215,"Bento do Norte-RN, e ao atual gestor,"
processual;,I-MULTA,I-RESSARCIMENTO,0.67124742639339,818,durante a instrução processual; . II –
Empreendimentos,I-RESSARCIMENTO,I-OBRIGACAO,0.36977327972704555,786,"empresa contratada Ibiúna Empreendimentos e Construções Ltda.,"
"Paraná/RN,",O,I-RECOMENDACAO,0.8218294948398377,736,"da Prefeitura de Paraná/RN, para que adote"
valor,O,I-RESSARCIMENTO,0.7879002185273254,787,"de ressarcimento do valor de R$ 37.379,78"
de,O,I-RECOMENDACAO,0.8401580612025976,767,"assim, a ocorrência de prescrição intercorrente, como"
fato,O,I-RESSARCIMENTO,0.8244845052084327,832,"provisão de fundos, fato que resultou no"
multa,B-MULTA,B-RECOMENDACAO,0.20929914269933345,594,pela aplicação da multa no valor de
multa,B-MULTA,B-RECOMENDACAO,0.20929914269933345,778,Pela aplicação de multa no percentual de
multa,B-MULTA,B-RECOMENDACAO,0.20929914269933345,830,c.2) Aplicação de multa no valor total
multa,B-MULTA,B-RECOMENDACAO,0.20929914269933345,230,pela aplicação da multa no valor de
"Contas,",O,I-RECOMENDACAO,0.8375724374450382,247,"desta Corte de Contas, que adote procedimentos"
SECEX,O,I-RECOMENDACAO,0.8303887087186212,236,Controle Externo – SECEX desta Corte de
"evite,",O,I-RECOMENDACAO,0.8400879735743275,767,"para que se evite, assim, a ocorrência"
"107,",I-OBRIGACAO,I-MULTA,0.8376799725221447,336,"termos do artigo 107, inciso II, alínea"
impõe,O,I-RESSARCIMENTO,0.6772071054496582,792,"devidamente atualizados, conforme impõe o art. 78,"
Unidades,O,I-RECOMENDACAO,0.8369705196305723,305,de prescrição nas Unidades Técnicas a ela
a,I-RESSARCIMENTO,I-MULTA,0.8508876492445475,836,mil) reais diante a não comprovação do
"2.900,00,",O,I-RESSARCIMENTO,0.6333606456504488,831,"valor de R$ 2.900,00, que se refere"
"Barcelona,",O,I-OBRIGACAO,0.5033180413224363,528,"ao Município de Barcelona, através do seu"
Campelo,O,I-OBRIGACAO,0.7414239387107086,849,Pereira de Lima Campelo da obrigação de
irregularidade,O,I-RESSARCIMENTO,0.8136887831178216,832,entender que a irregularidade foi sanada em
121/1994.,O,I-RESSARCIMENTO,0.7841325838018707,807,Lei Complementar nº 121/1994.
de,O,I-OBRIGACAO,0.6398146753451058,215,determinação à Diretoria de Despesas com Pessoal
presente,O,I-OBRIGACAO,0.8398584894419158,530,"gestor, acerca da presente decisão. Por fim,"
Unidades,O,I-RECOMENDACAO,0.8343556234104434,236,de prescrição nas Unidades Técnicas a ela
da,O,I-RESSARCIMENTO,0.6392752349019064,830,"cargo de Presidente da Câmara Municipal, acima"
com,O,I-MULTA,0.8427382115456967,717,"mês de 2022, com arrimo no art."
os,O,I-OBRIGACAO,0.7581587087392135,250,do Município e os respectivos planos de
posturas,O,I-OBRIGACAO,0.47287485413021674,700,de que adote posturas aptas à correção
quatro,O,I-RESSARCIMENTO,0.8372111310309631,807,e oitenta e quatro reais e oitenta
acumulação,O,I-RECOMENDACAO,0.8203463423890816,736,"e controle da acumulação de cargos, empregos"
de,O,I-RECOMENDACAO,0.832636160030074,236,recomende à Secretaria de Controle Externo –
sem,I-MULTA,I-RESSARCIMENTO,0.8367076321561221,223,aos Secretários Municipais sem previsão legal; b.2)
(quatorze,I-RESSARCIMENTO,I-MULTA,0.84685784973819,836,"de R$ 14.000,00 (quatorze mil) reais diante"
intimação,O,I-OBRIGACAO,0.7863530016156649,528,"a contar da intimação desta decisão, ao"
prescrição,O,I-RECOMENDACAO,0.8322450274172896,305,a consumação de prescrição nas Unidades Técnicas
de,O,I-RECOMENDACAO,0.8336850076709986,212,"SECEX desta Corte de Contas, que adote"
art.,O,I-MULTA,0.833855376768287,716,"objetiva consignada no art. 10, caput e"
a,O,I-RECOMENDACAO,0.8330821427626945,305,nas Unidades Técnicas a ela vinculadas. Por
–,I-RECOMENDACAO,B-OBRIGACAO,0.25106249632279465,408,"Resolução nº 018/2022 – TCE/RN. Deve, ainda,"
