token,label_original,label_sugerido,confianca,sentenca_idx,contexto
Tribunal,O,I-MULTA,0.9554640885094982,716,encaminhamento a este Tribunal das Contas Anuais
Secretaria,O,I-RECOMENDACAO,0.9459763175025174,767,se recomende à Secretaria de Controle Externo
seus,O,I-RECOMENDACAO,0.9123064477733867,736,"funções públicas dos seus servidores, evitando a"
que,O,I-RECOMENDACAO,0.494265684216059,700,"Em especial, para que se adotem providências"
se,O,I-OBRIGACAO,0.666483208771817,700,"especial, para que se adotem providências aptas"
Controle,O,I-RECOMENDACAO,0.9465786705115219,767,à Secretaria de Controle Externo – SECEX
diária,O,I-OBRIGACAO,0.9016303234672016,528,pena de multa diária ao Município e
a,O,I-RECOMENDACAO,0.9428075889855336,767,"nas Unidades Técnicas a ela vinculadas, para"
de,I-OBRIGACAO,O,0.8936057808028733,522,responsabilidade dos ordenadores de despesa e demais
a,I-OBRIGACAO,O,0.9612667220476201,616,464/2012; 2) determinar a imediata remessa de
"definitiva,",O,I-OBRIGACAO,0.7362567984581745,528,"“d” para solução definitiva, sob pena de"
seja,O,I-RESSARCIMENTO,0.6493437625024026,792,"sujeita à prescrição, seja por não ter"
de,O,I-RECOMENDACAO,0.775259075464029,736,realizar procedimentos periódicos de verificação e controle
desta,I-RESSARCIMENTO,I-MULTA,0.7492043077319118,858,do art. 102 desta mesma legislação; e
ao,O,I-MULTA,0.9316971435204191,651,aplicação de multa ao Sr. Aldemir Paulino
as,I-MULTA,I-OBRIGACAO,0.7573454292158491,786,"Público Estadual sobre as irregularidades constatadas, a"
ato,I-OBRIGACAO,O,0.9176998307867814,226,"pagamento decorrente do ato impugnado, sob pena"
Chefe,O,I-RECOMENDACAO,0.9266388238617087,397,ainda RECOMENDAR ao Chefe do Poder Executivo
art.,I-OBRIGACAO,O,0.8697989581264978,226,"confor-me reza o art. 313, parágrafo 1º,"
comissão,O,I-RESSARCIMENTO,0.6289225268399005,807,Pinto (membro da comissão de recebimento da
de,O,I-RESSARCIMENTO,0.7274993404381326,831,com diárias (elemento de despesa nº 339014)
seu,O,I-OBRIGACAO,0.950488438977113,530,"na pessoa do seu atual gestor, acerca"
conta,O,I-OBRIGACAO,0.9169312180737885,628,"diária, tendo em conta que a imposição"
Poder,O,I-RECOMENDACAO,0.6362092295617214,397,ao Chefe do Poder Executivo para que
Antônio,O,I-MULTA,0.9238954350355792,717,"ao Sr. José Antônio de Menezes Souza,"
a,O,I-RECOMENDACAO,0.9411520040692124,767,"Tribunal de Contas, a adoção de procedimentos"
e,O,I-RECOMENDACAO,0.8073373135317354,736,periódicos de verificação e controle da acumulação
o,O,I-RESSARCIMENTO,0.7945622083375357,831,339014) e com o aluguel do prédio
de,I-OBRIGACAO,O,0.9548288157918303,522,das Contas individualizadas de responsabilidade dos ordenadores
realizar,O,I-RECOMENDACAO,0.9310661129865467,736,no sentido de realizar procedimentos periódicos de
situações,O,I-RECOMENDACAO,0.7778043146362241,736,a repetição de situações como a destes
controlar,O,I-RECOMENDACAO,0.5070219354551111,700,providências aptas a controlar o acúmulo ilegal
deste,I-OBRIGACAO,O,0.9586020501244364,522,que as conclusões deste Parecer não excluem
"Corte,",I-OBRIGACAO,I-RESSARCIMENTO,0.6236829221034832,818,"enviado a esta Corte, no prazo de"
"II,",I-OBRIGACAO,I-MULTA,0.873301457573643,336,"artigo 107, inciso II, alínea “f”, da"
falhas,O,I-RECOMENDACAO,0.45155406362423217,700,à correção das falhas apontadas neste processo.
conforme,O,I-OBRIGACAO,0.8204385986077793,629,interessada em epígrafe conforme valor do salário
de,O,I-RECOMENDACAO,0.8436066108509706,736,evitando a repetição de situações como a
sentido,O,I-RECOMENDACAO,0.8556886360515634,736,providências administrativas no sentido de realizar procedimentos
com,I-RESSARCIMENTO,O,0.890385477869087,781,"do valor devido, com imposição de juros"
a,O,I-RECOMENDACAO,0.8079031417824002,736,"seus servidores, evitando a repetição de situações"
inciso,O,I-MULTA,0.9038005945541855,196,"do artigo 5º, inciso I, da Lei"
quatro,O,I-RESSARCIMENTO,0.731764582588343,675,"“0,74%” (setenta e quatro centésimos por cento)"
Controle,O,I-RECOMENDACAO,0.9335404506210242,142,à Secretaria de Controle Externo – SECEX
199/2016-1.ª,I-MULTA,O,0.9593366558571365,369,do Acórdão n.º 199/2016-1.ª Câmara.
não,O,I-RESSARCIMENTO,0.9362997583274244,792,porque tal matéria não se sujeita à
para,O,I-OBRIGACAO,0.6410244932080492,700,"processo. Em especial, para que se adotem"
"464/2012,",I-OBRIGACAO,O,0.8991372020048872,491,"Lei Complementar n.º 464/2012, com valor devidamente"
Câmara,O,I-RESSARCIMENTO,0.9236626722135202,792,"do Presidente da Câmara Municipal, seja porque"
que,O,I-OBRIGACAO,0.5581347760987065,700,a fim de que adote posturas aptas
tendo,O,I-OBRIGACAO,0.9380624884901253,628,"de multa diária, tendo em conta que"
de,O,I-OBRIGACAO,0.9118488112863068,528,"definitiva, sob pena de multa diária ao"
(sessenta),O,I-OBRIGACAO,0.9440137591286282,629,"prazo de 60 (sessenta) dias úteis, de"
proibição,O,I-OBRIGACAO,0.6062246769052653,215,110); d) Pela proibição ao Município São
IX.,I-RECOMENDACAO,O,0.9366383613098431,506,de Ativo Permanente; IX. Impossibilidade de apuração
que,O,I-RECOMENDACAO,0.7788558167970111,736,"de Paraná/RN, para que adote providências administrativas"
"responsável,",O,I-MULTA,0.9507313933664575,715,"em desfavor do responsável, Sr. Carlindson Onofre"
o,O,I-OBRIGACAO,0.8876458612249544,528,que deve observar o prazo máximo fixado
deve,O,I-OBRIGACAO,0.787007375065122,528,contendo cronograma que deve observar o prazo
do,I-RESSARCIMENTO,I-MULTA,0.8246543477485108,858,pelo inciso I do art. 102 desta
responsável,O,I-OBRIGACAO,0.8408487561367733,528,e ao gestor responsável no importe de
"10,",O,I-MULTA,0.8460351690370486,716,"consignada no art. 10, caput e inciso"
o,O,I-MULTA,0.9248146450814951,830,"São Tomé, durante o exercício financeiro de"
vistas,O,I-RECOMENDACAO,0.9359820253845607,253,adote procedimentos com vistas a impedir a
por,I-RESSARCIMENTO,I-MULTA,0.9403461770736229,781,a 10% (dez por cento) do valor
da,O,I-MULTA,0.9223230755132523,196,com artigo 29 da Resolução nº 04/2013-TCE.
que,O,I-OBRIGACAO,0.7256253809631897,528,"questão, contendo cronograma que deve observar o"
5º,O,I-MULTA,0.9499663420405282,430,"do RREO do 5º Bimestre de 2008,"
a,O,I-RESSARCIMENTO,0.9289916998114676,807,"e oitenta centavos), a ser devidamente atualizado,"
da,O,I-RECOMENDACAO,0.7888752878833687,736,"à atual gestão da Prefeitura de Paraná/RN,"
"1º,",I-OBRIGACAO,O,0.9253092113858074,226,"art. 313, parágrafo 1º, do Regimento Interno"
(Proc.,O,I-OBRIGACAO,0.660971906948622,628,responsabilidade já instaurado (Proc. nº 003474/2021-TC); d)
003474/2021-TC);,O,I-OBRIGACAO,0.7353724816272662,628,instaurado (Proc. nº 003474/2021-TC); d) pela não
Secretaria,O,I-RECOMENDACAO,0.9376622549091734,253,se recomende à Secretaria de Controle Externo
que,O,I-OBRIGACAO,0.9395180832890834,628,"proferido, uma vez que tal medida está"
"impugnado,",I-OBRIGACAO,O,0.9560896425426578,779,"decorrente do ato impugnado, sob pena de"
montante,O,I-RESSARCIMENTO,0.9284916092030764,792,"erário Municipal no montante de R$ 1.778,28"
do,I-MULTA,O,0.950764629045271,430,extinção da punibilidade do Sr. Ariosvaldo Targino
de,O,I-MULTA,0.921880829655062,830,o exercício financeiro de 2010: a) Aplicação
cinqüenta,I-MULTA,I-RESSARCIMENTO,0.9260292944816108,855,"mil, oitocentos e cinqüenta e seis reais),"
Complementar,I-OBRIGACAO,O,0.8749498646520898,561,"único, da Lei Complementar Estadual nº 464/12,"
autos,O,I-OBRIGACAO,0.7246710884018893,628,administrativas ocorrerá nos autos do processo de
referentes,O,I-MULTA,0.9528101504363201,716,"Gestão do IPPFICA, referentes ao exercício de"
à,O,I-RECOMENDACAO,0.7824367244499927,736,2) expedir Recomendação à atual gestão da
ao,O,I-OBRIGACAO,0.8825044654675896,215,d) Pela proibição ao Município São Bento
ao,O,I-OBRIGACAO,0.8473555871140929,528,de multa diária ao Município e ao
de,I-MULTA,O,0.8520149088196105,594,19 de janeiro de 2024; (iii) pela
Técnicas,O,I-RECOMENDACAO,0.9393081090241273,767,"anos nas Unidades Técnicas a ela vinculadas,"
dias,O,I-OBRIGACAO,0.9389672128313734,629,"de 60 (sessenta) dias úteis, de acordo"
cronograma,O,I-OBRIGACAO,0.8652191083535793,528,"em questão, contendo cronograma que deve observar"
Lei,O,I-MULTA,0.9128500308967916,810,"I, todos da Lei Complementar nº 121/94;"
multa,O,I-OBRIGACAO,0.7105979421515186,528,sob pena de multa diária ao Município
do,O,I-OBRIGACAO,0.8630723517623905,628,"causado pelo descumprimento do Decisum nele proferido,"
sede,O,I-RESSARCIMENTO,0.7738750218903571,831,do prédio da sede da Casa Legislativa
Técnicas,O,I-RECOMENDACAO,0.935339227456438,92,prescrição nas Unidades Técnicas a ela vinculadas.
caso.,I-RECOMENDACAO,O,0.9462394765515135,619,como no presente caso. Não estando presente
providências,O,I-RECOMENDACAO,0.88471348150813,736,para que adote providências administrativas no sentido
Por,I-OBRIGACAO,O,0.9441815246198297,88,as informações pertinentes. Por compreender que a
atual,O,I-OBRIGACAO,0.9289542441175507,530,"pessoa do seu atual gestor, acerca da"
sob,O,I-OBRIGACAO,0.9337479483530255,629,"providências abaixo descritas, sob pena de responsabilidade"
"constar,",O,I-OBRIGACAO,0.7011129209577619,629,"a fazer nela constar, de forma discriminada,"
atual,O,I-RECOMENDACAO,0.8883516939444548,736,expedir Recomendação à atual gestão da Prefeitura
para,O,I-RECOMENDACAO,0.7759374539090073,736,"Prefeitura de Paraná/RN, para que adote providências"
da,O,I-RESSARCIMENTO,0.9284716839488493,832,no pagamento indevido da supracitada quantia pelo
quadro,I-OBRIGACAO,O,0.8422377708061705,491,a regularização do quadro de pessoal do
do,O,I-RESSARCIMENTO,0.5602880887725706,830,"Câmara Municipal, acima do limite máximo legal"
recomende,O,I-RECOMENDACAO,0.6726611070587605,767,de que se recomende à Secretaria de
combinado,O,I-RESSARCIMENTO,0.8937394963602708,807,da Constituição Federal combinado com o artigo
ela,O,I-RECOMENDACAO,0.9367261475387361,142,"Unidades Técnicas a ela vinculadas. Também, pelo"
nas,O,I-RECOMENDACAO,0.9330599158651663,142,consumação de prescrição nas Unidades Técnicas a
públicos.,I-OBRIGACAO,O,0.9504061418282046,522,bens e valores públicos.
por,O,I-OBRIGACAO,0.9420176866275197,202,processo de pensão por morte a esta
Unidades,O,I-RECOMENDACAO,0.9339672856371576,92,de prescrição nas Unidades Técnicas a ela
mesma,I-RESSARCIMENTO,I-MULTA,0.7069042193579982,858,art. 102 desta mesma legislação; e c)
Novel,I-OBRIGACAO,I-MULTA,0.7067046806004386,336,"alínea `f`, do Novel Regimento Interno desta"
de,O,I-MULTA,0.914327804421106,464,"e 2º semestres de 2009, a fim"
R$,O,I-RESSARCIMENTO,0.9396960647349996,787,"do valor de R$ 37.379,78 (trinta e"
"erário,",O,I-RESSARCIMENTO,0.9004705894445454,831,"de ressarcir ao erário, do valor de"
a,O,I-RECOMENDACAO,0.9327291397318234,107,procedimentos com vistas a impedir a consumação
conforme,O,I-MULTA,0.9466136779421037,196,"seus vencimentos anuais, conforme previsão do artigo"
que,O,I-RESSARCIMENTO,0.9092507027915191,831,"de R$ 2.900,00, que se refere à"
gestão,O,I-RECOMENDACAO,0.7935166146712025,736,Recomendação à atual gestão da Prefeitura de
Externo,O,I-RECOMENDACAO,0.9338875435091301,142,Secretaria de Controle Externo – SECEX desta
origem,I-OBRIGACAO,O,0.8813937091775494,779,"do órgão de origem para que, em"
no,I-RECOMENDACAO,I-OBRIGACAO,0.9149509241641622,543,de monitoramento aportado no Evento 40); III
o,O,I-RESSARCIMENTO,0.8288592613717952,807,"Federal combinado com o artigo 78, incisos"
para,O,I-OBRIGACAO,0.7314720221609895,528,Tribunal um plano para enfrentamento e eliminação
procedimentos,O,I-RECOMENDACAO,0.9300808835697884,92,"Contas, que adote procedimentos com vistas a"
de,O,I-RECOMENDACAO,0.9326645666111091,107,recomende à Secretaria de Controle Externo –
Técnicas,O,I-RECOMENDACAO,0.9313982041668567,107,prescrição nas Unidades Técnicas a ela vinculadas;
Unidades,O,I-RECOMENDACAO,0.9323561153889685,107,de prescrição nas Unidades Técnicas a ela
da,O,I-RESSARCIMENTO,0.7613322560612268,807,Aribaldo Filho (presidente da comissão de recebimento
c),I-MULTA,O,0.8415339605904085,577,semestre de 2012; c) Multa de R$
SECEX,O,I-RECOMENDACAO,0.9111568137683606,142,Controle Externo – SECEX desta Corte de
ela,O,I-RECOMENDACAO,0.9322310293956091,107,"Unidades Técnicas a ela vinculadas; Por fim,"
Externo,O,I-RECOMENDACAO,0.936304594106704,767,Secretaria de Controle Externo – SECEX deste
Municipal,I-RECOMENDACAO,O,0.9511876573140557,638,referência pelo Ente Municipal em epígrafe.
Secretaria,O,I-RECOMENDACAO,0.9327582566690552,92,se recomende à Secretaria de Controle Externo
da,O,I-OBRIGACAO,0.9310684929121227,629,do vencimento básico da parte interessada em
integralmente,O,I-RESSARCIMENTO,0.9192280952094496,792,dever de ressarcir integralmente o erário Municipal
"464/2012,",I-OBRIGACAO,O,0.9101033674803275,616,"da LCE nº 464/2012, cientificando o Parquet"
pelo,O,I-OBRIGACAO,0.9281923834707302,628,ao erário causado pelo descumprimento do Decisum
pelo,O,I-OBRIGACAO,0.9264968412648642,629,"à autoridade responsável pelo OURO BRANCOPREV, para"
mil,I-OBRIGACAO,I-RESSARCIMENTO,0.843285314223403,818,(cento e dezoito mil quatrocentos e vinte
e,O,I-MULTA,0.8975321250646006,716,"R$ 1.100,00 (mil e cem reais), em"
a,O,I-RECOMENDACAO,0.9338169500241281,767,"se evite, assim, a ocorrência de prescrição"
gestor,O,I-OBRIGACAO,0.932332304737834,202,"multa diária ao gestor responsável, nos termos"
aprovação,I-OBRIGACAO,O,0.9391993772187915,671,do concurso de aprovação da servidora para
TCE/RN;,O,I-MULTA,0.7875174285465191,675,"cento) para o TCE/RN; (b) em 2025,"
atraso,O,I-MULTA,0.7678923888795056,464,"ofício, quanto ao atraso no envio dos"
ces-sar,I-OBRIGACAO,O,0.9070133434407919,226,"regularizadoras cabíveis, fazendo ces-sar todo e qualquer"
ilegal,O,I-OBRIGACAO,0.4838667581761747,700,controlar o acúmulo ilegal de cargos públicos;
Externo,O,I-RECOMENDACAO,0.9298936009527816,92,Secretaria de Controle Externo – SECEX desta
Técnicas,O,I-RECOMENDACAO,0.9315033425084196,253,prescrição nas Unidades Técnicas a ela vinculadas.
de,O,I-RECOMENDACAO,0.9189051077803982,142,recomende à Secretaria de Controle Externo –
vez,O,I-OBRIGACAO,0.8520770885655008,628,"nele proferido, uma vez que tal medida"
nove,O,I-RESSARCIMENTO,0.8118388758795173,787,e setenta e nove reais e setenta
vistas,O,I-RECOMENDACAO,0.9259593682093006,92,adote procedimentos com vistas a impedir a
ao,O,I-OBRIGACAO,0.8007124103469334,528,ao Município e ao gestor responsável no
nos,I-RESSARCIMENTO,O,0.9204130769639949,856,"irregularidade das contas, nos termos do art."
do,O,I-OBRIGACAO,0.9306428704859028,202,"Contas para análise do feito, sob pena"
"1.100,00",O,I-MULTA,0.9389220992516263,716,"total de R$ 1.100,00 (mil e cem"
Norte,I-RECOMENDACAO,O,0.8833535398484671,636,Rio Grande do Norte com vistas a
do,I-MULTA,O,0.9502616623331168,93,que afasta aplicação do art. 107 §
conforme,I-MULTA,O,0.8407228034660649,858,"de guias bancárias, conforme determina os arts."
ordenadores,I-OBRIGACAO,O,0.9468478750385262,522,de responsabilidade dos ordenadores de despesa e
verificação,O,I-RECOMENDACAO,0.8696530990045773,736,procedimentos periódicos de verificação e controle da
(elemento,O,I-RESSARCIMENTO,0.8518334620979192,831,Casa Legislativa Municipal (elemento de despesa nº
do,I-OBRIGACAO,O,0.9503488595427819,616,que a íntegra do processo está disponível
Controle,O,I-RECOMENDACAO,0.9310256059853426,107,à Secretaria de Controle Externo – SECEX
"atualizados,",O,I-RESSARCIMENTO,0.9171324032410463,792,"a serem devidamente atualizados, conforme impõe o"
se,O,I-RESSARCIMENTO,0.9057356660450177,831,"R$ 2.900,00, que se refere à soma"
prédio,O,I-RESSARCIMENTO,0.8999395900994218,831,o aluguel do prédio da sede da
desfavor,O,I-MULTA,0.9449482684296961,716,"cem reais), em desfavor do Sr. Bruno"
inteiro,I-OBRIGACAO,O,0.9461946809765235,671,"acordo com o inteiro teor desta Decisão,"
ela,O,I-RECOMENDACAO,0.929250406795353,92,"Unidades Técnicas a ela vinculadas. Por fim,"
que,O,I-RECOMENDACAO,0.9331442582713996,767,vistas a impedir que processos fiquem paralisados
a,O,I-RECOMENDACAO,0.9292113340815444,92,procedimentos com vistas a impedir a consumação
ocorrência,O,I-RECOMENDACAO,0.9326665384106849,767,"evite, assim, a ocorrência de prescrição intercorrente,"
compõe,O,I-OBRIGACAO,0.5886094153908188,629,cada parcela que compõe a remuneração da
à,O,I-RESSARCIMENTO,0.8671854418954557,831,que se refere à soma das despesas
–,O,I-RECOMENDACAO,0.9259065002837513,92,de Controle Externo – SECEX desta Corte
"dias,",O,I-OBRIGACAO,0.9044400349879689,528,"de 60 (sessenta) dias, a contar da"
de,O,I-MULTA,0.7488597208851581,464,"multa no valor de R$ 1.000,00 (hum"
"questão,",O,I-OBRIGACAO,0.6760371802405223,528,"da irregularidade em questão, contendo cronograma que"
ante,O,I-MULTA,0.9391486761401765,717,"e oitocentos reais), ante o atraso na"
Unidade,O,B-RECOMENDACAO,0.20929914269933345,408,atual responsável pela Unidade de Controle Interno
as,O,B-RECOMENDACAO,0.20929914269933345,830,"TCE/RN). d) Considerando as contas como Irregulares,"
121/1994,O,B-RECOMENDACAO,0.20929914269933345,830,Complementar n. º 121/1994 (Lei Orgânica do
da,O,B-RECOMENDACAO,0.20929914269933345,830,"§2. º, “b” da Lei Complementar n."
"78,",O,B-RECOMENDACAO,0.20929914269933345,830,"cabíveis, conforme art. 78, §2. º, “b”"
art.,O,B-RECOMENDACAO,0.20929914269933345,830,"criminais cabíveis, conforme art. 78, §2. º,"
"cabíveis,",O,B-RECOMENDACAO,0.20929914269933345,830,"cíveis e criminais cabíveis, conforme art. 78,"
Ministério,O,B-RECOMENDACAO,0.20929914269933345,830,Estado e ao Ministério Público para a
Estado,O,B-RECOMENDACAO,0.20929914269933345,830,Procuradoria Geral do Estado e ao Ministério
comandos,O,B-RECOMENDACAO,0.20929914269933345,594,de todos os comandos desta Decisão; x)
os,O,B-RECOMENDACAO,0.20929914269933345,594,cumprimento de todos os comandos desta Decisão;
de,O,B-RECOMENDACAO,0.20929914269933345,594,"ainda, o cumprimento de todos os comandos"
"ainda,",O,B-RECOMENDACAO,0.20929914269933345,594,"DAP que monitore, ainda, o cumprimento de"
determinação,O,B-RECOMENDACAO,0.20929914269933345,594,deferida; ix) pela determinação à Diretoria de
medida,O,B-RECOMENDACAO,0.20929914269933345,594,de parte da medida cautelar deferida; ix)
pelo,O,B-RECOMENDACAO,0.20929914269933345,830,"da Constituição Federal, pelo pagamento acima do"
Prefeito,O,B-RECOMENDACAO,0.20929914269933345,408,"de Alencar Carvalho, Prefeito do Município de"
de,O,B-RECOMENDACAO,0.20929914269933345,530,anteriormente nesta proposta de voto.
anteriormente,O,B-RECOMENDACAO,0.20929914269933345,530,as determinações expostas anteriormente nesta proposta de
representar,O,B-RECOMENDACAO,0.20929914269933345,594,Decisão; x) por representar imediatamente ao Ministério
de,O,B-RECOMENDACAO,0.20929914269933345,778,d) Pela aplicação de multa no percentual
trânsito,O,B-RECOMENDACAO,0.20929914269933345,830,"após o seu trânsito em julgado, de"
de,O,B-RECOMENDACAO,0.20929914269933345,835,Determando o encaminhamento de cópias das principais
após,O,B-RECOMENDACAO,0.20929914269933345,830,"d.1) Imediata remessa, após o seu trânsito"
por,O,B-RECOMENDACAO,0.20929914269933345,594,desta Decisão; x) por representar imediatamente ao
das,O,B-RECOMENDACAO,0.20929914269933345,835,encaminhamento de cópias das principais peças deste
Imediata,O,B-RECOMENDACAO,0.20929914269933345,830,"por cento). d.1) Imediata remessa, após o"
(oitenta,O,B-RECOMENDACAO,0.20929914269933345,830,foi de 86% (oitenta e seis por
"Redondo/RN,",O,B-RECOMENDACAO,0.20929914269933345,408,"Município de Campo Redondo/RN, e Sr. Renam"
que,O,B-RECOMENDACAO,0.20929914269933345,830,"pagamento, uma vez que o percentual atingido"
sua,O,B-RECOMENDACAO,0.20929914269933345,830,por cento) de sua receita com folha
Decisão;,O,B-RECOMENDACAO,0.20929914269933345,594,os comandos desta Decisão; x) por representar
70%,O,B-RECOMENDACAO,0.20929914269933345,830,máximo legal de 70% (setenta por cento)
expostas,O,B-RECOMENDACAO,0.20929914269933345,530,consoante as determinações expostas anteriormente nesta proposta
parte,O,B-RECOMENDACAO,0.20929914269933345,594,do descumprimento de parte da medida cautelar
do,O,B-RECOMENDACAO,0.20929914269933345,408,"Alencar Carvalho, Prefeito do Município de Campo"
do,O,B-RECOMENDACAO,0.20929914269933345,594,cominada em função do descumprimento de parte
que,O,B-RECOMENDACAO,0.20929914269933345,594,"- DAE, para que promova a execução"
Parecer,O,B-RECOMENDACAO,0.20929914269933345,726,as conclusões deste Parecer não excluem o
"julgamento,",O,B-RECOMENDACAO,0.20929914269933345,726,"não excluem o julgamento, por este Tribunal,"
de,O,B-RECOMENDACAO,0.20929914269933345,726,responsabilidade dos ordenadores de despesa e demais
pela,O,B-RECOMENDACAO,0.20929914269933345,594,art. 110); iv) pela confirmação da medida
por,O,B-RECOMENDACAO,0.20929914269933345,726,"e demais responsáveis por dinheiros, bens e"
bens,O,B-RECOMENDACAO,0.20929914269933345,726,"responsáveis por dinheiros, bens e valores públicos."
art.,O,B-RECOMENDACAO,0.20929914269933345,830,"o ato, conforme art. 78, §2. º,"
valores,O,B-RECOMENDACAO,0.20929914269933345,726,"dinheiros, bens e valores públicos."
agente,O,B-RECOMENDACAO,0.20929914269933345,830,a responsabilidade do agente que praticou o
responsabilidade,O,B-RECOMENDACAO,0.20929914269933345,830,c.3) Fixar a responsabilidade do agente que
a,O,B-RECOMENDACAO,0.20929914269933345,830,TCE/RN); c.3) Fixar a responsabilidade do agente
Fixar,O,B-RECOMENDACAO,0.20929914269933345,830,do TCE/RN); c.3) Fixar a responsabilidade do
confirmação,O,B-RECOMENDACAO,0.20929914269933345,594,"contratação; v) pela confirmação da determinação para,"
aplicação,O,B-RECOMENDACAO,0.20929914269933345,594,"1.000,00; vi) pela aplicação da multa no"
Decisão.,O,B-RECOMENDACAO,0.20929914269933345,408,dos termos desta Decisão.
conclusões,O,B-RECOMENDACAO,0.20929914269933345,726,Esclarecer que as conclusões deste Parecer não
que,O,B-RECOMENDACAO,0.20929914269933345,726,Município. 6) Esclarecer que as conclusões deste
6),O,B-RECOMENDACAO,0.20929914269933345,726,contábeis do Município. 6) Esclarecer que as
contábeis,O,B-RECOMENDACAO,0.20929914269933345,726,qualidade das informações contábeis do Município. 6)
ao,O,B-RECOMENDACAO,0.20929914269933345,594,por representar imediatamente ao Ministério Público Estadual
e,O,B-RECOMENDACAO,0.20929914269933345,594,"Diretoria de Atos e Execuções - DAE,"
Atos,O,B-RECOMENDACAO,0.20929914269933345,594,à Diretoria de Atos e Execuções -
expedição,O,B-RECOMENDACAO,0.20929914269933345,594,presentes; vii) pela expedição de recomendação para
vii),O,B-RECOMENDACAO,0.20929914269933345,594,comandos nela presentes; vii) pela expedição de
à,O,B-RECOMENDACAO,0.20929914269933345,830,"peças que indicar, à Procuradoria Geral do"
que,O,B-RECOMENDACAO,0.20929914269933345,830,"ou das peças que indicar, à Procuradoria"
em,O,B-RECOMENDACAO,0.20929914269933345,594,da multa cominada em função do descumprimento
ou,O,B-RECOMENDACAO,0.20929914269933345,830,"autenticadas do processo, ou das peças que"
o,O,B-RECOMENDACAO,0.20929914269933345,830,"Imediata remessa, após o seu trânsito em"
Emissão,O,B-RECOMENDACAO,0.20929914269933345,726,nº 012/2016-TCE. 5) Emissão de recomendação ao
recomendação,O,B-RECOMENDACAO,0.20929914269933345,726,5) Emissão de recomendação ao atual Chefe
do,O,B-RECOMENDACAO,0.20929914269933345,830,121/1994 (Lei Orgânica do TCERN); c.4) Imediata
n.,O,B-RECOMENDACAO,0.20929914269933345,830,da Lei Complementar n. º 121/1994 (Lei
“a”,O,B-RECOMENDACAO,0.20929914269933345,830,"78, §2. º, “a” da Lei Complementar"
Chefe,O,B-RECOMENDACAO,0.20929914269933345,726,recomendação ao atual Chefe do Poder Executivo
de,O,B-RECOMENDACAO,0.20929914269933345,830,"trânsito em julgado, de cópias autenticadas do"
quanto,O,B-RECOMENDACAO,0.20929914269933345,495,seus quadros; h) quanto à determinação acima
121/1994.,O,B-RECOMENDACAO,0.20929914269933345,835,da LCE n.º 121/1994. Determando o encaminhamento
"3º,",O,B-RECOMENDACAO,0.20929914269933345,835,"“a” e § 3º, alínea “a”, da"
de,O,B-RECOMENDACAO,0.20929914269933345,778,reais) pela aquisição de polpas de frutas;
seis,O,B-RECOMENDACAO,0.20929914269933345,778,"96,00 (noventa e seis reais) pela aquisição"
(noventa,O,B-RECOMENDACAO,0.20929914269933345,778,"de R$ 96,00 (noventa e seis reais)"
de,O,B-RECOMENDACAO,0.20929914269933345,778,"às anteriores condenações de R$ 96,00 (noventa"
improbidade,O,B-RECOMENDACAO,0.20929914269933345,778,"e/ou atos de improbidade administrativa, e ainda,"
infrações,O,B-RECOMENDACAO,0.20929914269933345,778,apuração de eventuais infrações penais e/ou atos
apuração,O,B-RECOMENDACAO,0.20929914269933345,778,"Público Estadual, para apuração de eventuais infrações"
de,O,B-RECOMENDACAO,0.20929914269933345,778,"polpas de frutas; de R$ 55.000,00 (cinquenta"
ao,O,B-RECOMENDACAO,0.20929914269933345,495,f) pela proibição ao Município de Lagoa
pela,O,B-RECOMENDACAO,0.20929914269933345,495,de mora; f) pela proibição ao Município
processo,O,B-RECOMENDACAO,0.20929914269933345,778,autenticada do presente processo ao Ministério Público
cópia,O,B-RECOMENDACAO,0.20929914269933345,778,Pela remessa de cópia autenticada do presente
"21º,",O,B-RECOMENDACAO,0.20929914269933345,830,"art. %%, § 21º, da LRF: a)"
art.,O,B-RECOMENDACAO,0.20929914269933345,830,"nos termos do art. %%, § 21º,"
do,O,B-RECOMENDACAO,0.20929914269933345,830,"semestre/2010, nos termos do art. %%, §"
k),O,B-RECOMENDACAO,0.20929914269933345,495,subsistência de mora; k) por representar imediatamente
proibição,O,B-RECOMENDACAO,0.20929914269933345,495,mora; f) pela proibição ao Município de
